ProjectName;Key;title_desc;Type;Created;LastUpdatedStatus;LastUpdatedStatusDate;Priority;Storypoint;NumWatchers;NumComments;NumIssueLinks;NumAffectedVersions;NumFixVersions;NumChangeHistory;P;S;R
WT;WT-4305;add gating variable long running prepare support gating variable used control incremental work long running prepared transactions;New Feature;2018-09-10T02:25:29.000+0000;Closed;2018-09-24T14:32:58.000+0000;Major - P3;1.0;2;5;1;0;4;17;1;0;4
WT;WT-4314;dont access unmapped pages evicting tree lsm page block manager null trying free inmemory page call stack code thread 1 python received signal sigsegv segmentation fault 0x00007ffff5da7e63 __wt_page_out session0x555555f18570 pagep0x555556033990 src btree bt_discard c100100 void s2bt session bm map_discard gdb bt#0 0x00007ffff5da7e63 __wt_page_out session0x555555f18570 pagep0x555556033990 src btree bt_discard c100#1 0x00007ffff5da7c78 __wt_ref_out session0x555555f18570 ref0x555556033990 src btree bt_discard c44#2 0x00007ffff5e753e7 __wt_evict_file session0x555555f18570 syncopwt_sync_discard src evict evict_file c128#3 0x00007ffff5dda142 __wt_cache_op session0x555555f18570 opwt_sync_discard src btree bt_sync c439#4 0x00007ffff5e17b29 __wt_conn_dhandle_close session0x555555f18570 finaltrue mark_deadfalse src conn conn_dhandle c374#5 0x00007ffff5e18fc5 __wt_conn_dhandle_discard_single session0x555555f18570 finaltrue mark_deadfalse src conn conn_dhandle c730#6 0x00007ffff5e196af __wt_conn_dhandle_discard session0x555555f18570 src conn conn_dhandle c798#7 0x00007ffff5e1f211 __wt_connection_close conn0x555555f00ce0 src conn conn_open c112#8 0x00007ffff5e07e32 __conn_close wt_conn0x555555f00ce0 config0x0 src conn conn_api c1147#9 0x00007ffff61bff31 _wrap_connection_close selfoptimised argsoptimised wiredtiger_wrap c8645 code test simple insert update remove three k v pair make backup copy open backup copy insert update remove operations;Bug;2018-09-13T06:21:14.000+0000;Closed;2018-09-24T14:31:13.000+0000;Major - P3;1.0;4;6;1;0;3;13;1;0;4
WT;WT-4303;performance regression btree load time 7 regression parallel pop btree load time metric since build #4977 http build wiredtiger com8080 job wiredtiger perf btree 4977 wiredtiger perf btree job btree insert throughput metric started degrade around build wt 4243 wt 4261 tickets newly introduced build #4977 image 2018 09 10 10 53 29 128 png width706 height440image 2018 09 10 10 53 49 277 png width704 height442image 2018 09 10 10 54 03 363 png width772 height166;Bug;2018-09-10T00:52:15.000+0000;Closed;2018-09-24T14:30:04.000+0000;Major - P3;1.0;4;4;2;0;0;18;1;0;4
WT;WT-4279;cursor modify timed failure valgrind job http build wiredtiger com8080 job wiredtiger valgrind 2931 failed unique error weve seen unfortunately failure several days ago directory overwritten noformat fail test_wt4105_large_doc_small_updcursor modify timed noformat;Bug;2018-08-28T18:03:17.000+0000;Closed;2018-09-24T14:29:43.000+0000;Major - P3;1.0;5;4;0;0;0;10;1;0;4
WT;WT-3736;add statistics measure contention lookaside cursor lookaside cache overflow table wiredtiger 5 cursors open shared threads writing lookaside table contention using cursors start backing acquiring one using sleep see __wt_las_cursor code add statistic tell us contention lookaside cursors consider implementing smarter access scheme;Improvement;2017-11-10T01:18:14.000+0000;Closed;2018-09-24T14:31:51.000+0000;Major - P3;1.0;4;6;0;0;4;34;1;0;4
WT;WT-3914;add general documentation prepared transactions need update documentation src doc transaction dox describe wt_sessionprepare_transaction api works semantics transactional operations expect interacting prepared transactions;New Feature;2018-02-13T01:18:52.000+0000;Closed;2018-09-24T14:30:09.000+0000;Major - P3;1.0;5;6;0;0;3;20;1;0;4
WT;WT-4190;decrease shutdown time multi threaded cache flush running insert benchmark mongodb 3 6 5 4 0 0 wiredtiger learned https groups google com forum #topic wiredtiger users fvvmcvqla_e open discuss making mongod shutdown faster one example line represents separate configuration legend secs seconds shutdown cachegb size wt cache gb sps syncperiodsecs value ct value eviction_checkpoint_target def default dirty value eviction_dirty_trigger def default config see gist https gist github com mdcallag 73124368545bcdd1ae84cee259429d43 wgb gb writes shutdown per iostat wmb average rate write mb shutdown secs cachegb sps ct dirty config wgb wmb 63 120 60 def def v1 8 0 135 5 65 120 300 def def v2 8 1 133 0 789 120 60 1 90 v6 43 5 55 2 816 120 60 10 90 v7 43 5 53 4 476 120 300 1 90 v10 27 6 58 1 471 120 300 10 90 v11 27 8 59 1 123 120 300 0 20 v13 19 3 157 1 120 120 300 1 20 v14 12 3 103 1 315 120 300 0 40 v16 22 5 71 7 308 120 300 1 40 v17 21 1 68 8 357 120 300 0 60 v19 17 4 48 8 354 120 300 1 60 v20 16 5 46 7 448 120 300 0 80 v22 23 8 53 0 447 120 300 1 80 v23 24 0 53 7 68 120 30 def def v25 18 9 281 8 65 120 180 def def v26 22 0 343 3 64 120 600 def def v27 32 5 516 5 min time shutdown 60 seconds get b tree needs flush dirty pages shutdown crash recovery startup cant instantaneous wmb numbers except last 3 configurations write io rate isnt great considering storage devices sustain 1gb measured load insert benchmark 250m docs inserted 16 clients using separate collection shutting mongod insert ends see http smalldatum blogspot com 2017 06 insert benchmark html insert benchmark includes link code;Improvement;2018-07-20T18:45:25.000+0000;Closed;2019-05-30T03:49:07.000+0000;Major - P3;1.0;11;13;0;2;3;51;1;0;4
WT;WT-4107;reduce lookaside usage update heavy workloads history pinned seen workloads many updates one large values dont allow oldest transaction id timestamp move forward optimizing cases restricted wiredtiger manages history must held cache dont version values written data files beyond checkpoints wiredtiger allows history fits cache using lookaside cache overflow mechanism currently possible page several different states disk content cache memory history cache limbo single version data memory history lookaside file time update made entry page full history needs instantiated cases hot records memory page image greater memory_page_max trigger wiredtiger forcibly evicting page reproduce workload pathologically reads writes pages lookaside investigate make efficient;Improvement;2018-06-01T03:28:08.000+0000;Closed;2019-10-22T23:41:36.000+0000;Major - P3;1.0;8;3;2;0;0;52;1;0;4
WT;WT-5180;exclude git evergreen artifact tar ball git folder occasionally causing permission issue extracting tar ball unexpectedly failing subsequent tasks heres one example patch build log code 2019 10 10 211914 637 task logger initialized agent revision 49e6f044e070bba4ae4fdb05d640f8c796a8b9f0 2019 10 10 211914 670 starting task wiredtiger_ubuntu1804_unit_test_bucket07_patch_8d9f164f5cd5f69b48f786b91d5451823ae97dae_5d9fd2c09ccd4e6068b5ae4b_19_10_11_00_54_58 execution 0 2019 10 10 211914 772 running pre task commands 2019 10 10 211914 787 running command shell exec cleanup step 1 1 2019 10 10 211914 790 finished running pre task commands 2019 10 10 211914 790 running command s3 get fetch artifacts step 1 2 2019 10 10 211914 806 fetching wiredtiger ubuntu1804 8d9f164f5cd5f69b48f786b91d5451823ae97dae artifacts compile_wiredtiger_ubuntu1804_patch_8d9f164f5cd5f69b48f786b91d5451823ae97dae_5d9fd2c09ccd4e6068b5ae4b_19_10_11_00_54_58 tgz s3 bucket build_external attempt 1 10 2019 10 10 212414 806 fetching wiredtiger ubuntu1804 8d9f164f5cd5f69b48f786b91d5451823ae97dae artifacts compile_wiredtiger_ubuntu1804_patch_8d9f164f5cd5f69b48f786b91d5451823ae97dae_5d9fd2c09ccd4e6068b5ae4b_19_10_11_00_54_58 tgz s3 bucket build_external attempt 2 10 2019 10 10 212416 842 fetching wiredtiger ubuntu1804 8d9f164f5cd5f69b48f786b91d5451823ae97dae artifacts compile_wiredtiger_ubuntu1804_patch_8d9f164f5cd5f69b48f786b91d5451823ae97dae_5d9fd2c09ccd4e6068b5ae4b_19_10_11_00_54_58 tgz s3 bucket build_external attempt 3 10 2019 10 10 212419 536 fetching wiredtiger ubuntu1804 8d9f164f5cd5f69b48f786b91d5451823ae97dae artifacts compile_wiredtiger_ubuntu1804_patch_8d9f164f5cd5f69b48f786b91d5451823ae97dae_5d9fd2c09ccd4e6068b5ae4b_19_10_11_00_54_58 tgz s3 bucket build_external attempt 4 10 2019 10 10 212421 947 fetching wiredtiger ubuntu1804 8d9f164f5cd5f69b48f786b91d5451823ae97dae artifacts compile_wiredtiger_ubuntu1804_patch_8d9f164f5cd5f69b48f786b91d5451823ae97dae_5d9fd2c09ccd4e6068b5ae4b_19_10_11_00_54_58 tgz s3 bucket build_external attempt 5 10 2019 10 10 212432 125 fetching wiredtiger ubuntu1804 8d9f164f5cd5f69b48f786b91d5451823ae97dae artifacts compile_wiredtiger_ubuntu1804_patch_8d9f164f5cd5f69b48f786b91d5451823ae97dae_5d9fd2c09ccd4e6068b5ae4b_19_10_11_00_54_58 tgz s3 bucket build_external attempt 6 10 2019 10 10 212441 926 fetching wiredtiger ubuntu1804 8d9f164f5cd5f69b48f786b91d5451823ae97dae artifacts compile_wiredtiger_ubuntu1804_patch_8d9f164f5cd5f69b48f786b91d5451823ae97dae_5d9fd2c09ccd4e6068b5ae4b_19_10_11_00_54_58 tgz s3 bucket build_external attempt 7 10 2019 10 10 212456 161 fetching wiredtiger ubuntu1804 8d9f164f5cd5f69b48f786b91d5451823ae97dae artifacts compile_wiredtiger_ubuntu1804_patch_8d9f164f5cd5f69b48f786b91d5451823ae97dae_5d9fd2c09ccd4e6068b5ae4b_19_10_11_00_54_58 tgz s3 bucket build_external attempt 8 10 2019 10 10 212516 206 fetching wiredtiger ubuntu1804 8d9f164f5cd5f69b48f786b91d5451823ae97dae artifacts compile_wiredtiger_ubuntu1804_patch_8d9f164f5cd5f69b48f786b91d5451823ae97dae_5d9fd2c09ccd4e6068b5ae4b_19_10_11_00_54_58 tgz s3 bucket build_external attempt 9 10 2019 10 10 212536 229 fetching wiredtiger ubuntu1804 8d9f164f5cd5f69b48f786b91d5451823ae97dae artifacts compile_wiredtiger_ubuntu1804_patch_8d9f164f5cd5f69b48f786b91d5451823ae97dae_5d9fd2c09ccd4e6068b5ae4b_19_10_11_00_54_58 tgz s3 bucket build_external attempt 10 10 2019 10 10 212556 265 command failed s3 get failed 10 attempts code heres detailed log agent log code 2019 10 10 211914 790 set command timeout s3 get fetch artifacts #1 2h0m0s 2019 10 10 212414 806 problem getting wiredtiger ubuntu1804 8d9f164f5cd5f69b48f786b91d5451823ae97dae artifacts compile_wiredtiger_ubuntu1804_patch_8d9f164f5cd5f69b48f786b91d5451823ae97dae_5d9fd2c09ccd4e6068b5ae4b_19_10_11_00_54_58 tgz s3 bucket retrying problem extracting wiredtiger ubuntu1804 8d9f164f5cd5f69b48f786b91d5451823ae97dae artifacts compile_wiredtiger_ubuntu1804_patch_8d9f164f5cd5f69b48f786b91d5451823ae97dae_5d9fd2c09ccd4e6068b5ae4b_19_10_11_00_54_58 tgz archive error extracting data mci a8fdeb39f8c4fd0f291cd230e61cfa52 wiredtiger net http request canceled client timeout exceeded reading body 2019 10 10 212416 842 problem getting wiredtiger ubuntu1804 8d9f164f5cd5f69b48f786b91d5451823ae97dae artifacts compile_wiredtiger_ubuntu1804_patch_8d9f164f5cd5f69b48f786b91d5451823ae97dae_5d9fd2c09ccd4e6068b5ae4b_19_10_11_00_54_58 tgz s3 bucket retrying problem extracting wiredtiger ubuntu1804 8d9f164f5cd5f69b48f786b91d5451823ae97dae artifacts compile_wiredtiger_ubuntu1804_patch_8d9f164f5cd5f69b48f786b91d5451823ae97dae_5d9fd2c09ccd4e6068b5ae4b_19_10_11_00_54_58 tgz archive error extracting data mci a8fdeb39f8c4fd0f291cd230e61cfa52 wiredtiger open data mci a8fdeb39f8c4fd0f291cd230e61cfa52 wiredtiger git objects 1f 423e90cf0d6a88be5f2818f8df88408698d35b permission denied 2019 10 10 212419 536 problem getting wiredtiger ubuntu1804 8d9f164f5cd5f69b48f786b91d5451823ae97dae artifacts compile_wiredtiger_ubuntu1804_patch_8d9f164f5cd5f69b48f786b91d5451823ae97dae_5d9fd2c09ccd4e6068b5ae4b_19_10_11_00_54_58 tgz s3 bucket retrying problem extracting wiredtiger ubuntu1804 8d9f164f5cd5f69b48f786b91d5451823ae97dae artifacts compile_wiredtiger_ubuntu1804_patch_8d9f164f5cd5f69b48f786b91d5451823ae97dae_5d9fd2c09ccd4e6068b5ae4b_19_10_11_00_54_58 tgz archive error extracting data mci a8fdeb39f8c4fd0f291cd230e61cfa52 wiredtiger open data mci a8fdeb39f8c4fd0f291cd230e61cfa52 wiredtiger git objects 1f 423e90cf0d6a88be5f2818f8df88408698d35b permission denied 2019 10 10 212421 947 problem getting wiredtiger ubuntu1804 8d9f164f5cd5f69b48f786b91d5451823ae97dae artifacts compile_wiredtiger_ubuntu1804_patch_8d9f164f5cd5f69b48f786b91d5451823ae97dae_5d9fd2c09ccd4e6068b5ae4b_19_10_11_00_54_58 tgz s3 bucket retrying problem extracting wiredtiger ubuntu1804 8d9f164f5cd5f69b48f786b91d5451823ae97dae artifacts compile_wiredtiger_ubuntu1804_patch_8d9f164f5cd5f69b48f786b91d5451823ae97dae_5d9fd2c09ccd4e6068b5ae4b_19_10_11_00_54_58 tgz archive error extracting data mci a8fdeb39f8c4fd0f291cd230e61cfa52 wiredtiger open data mci a8fdeb39f8c4fd0f291cd230e61cfa52 wiredtiger git objects 1f 423e90cf0d6a88be5f2818f8df88408698d35b permission denied 2019 10 10 212432 125 problem getting wiredtiger ubuntu1804 8d9f164f5cd5f69b48f786b91d5451823ae97dae artifacts compile_wiredtiger_ubuntu1804_patch_8d9f164f5cd5f69b48f786b91d5451823ae97dae_5d9fd2c09ccd4e6068b5ae4b_19_10_11_00_54_58 tgz s3 bucket retrying problem extracting wiredtiger ubuntu1804 8d9f164f5cd5f69b48f786b91d5451823ae97dae artifacts compile_wiredtiger_ubuntu1804_patch_8d9f164f5cd5f69b48f786b91d5451823ae97dae_5d9fd2c09ccd4e6068b5ae4b_19_10_11_00_54_58 tgz archive error extracting data mci a8fdeb39f8c4fd0f291cd230e61cfa52 wiredtiger open data mci a8fdeb39f8c4fd0f291cd230e61cfa52 wiredtiger git objects 1f 423e90cf0d6a88be5f2818f8df88408698d35b permission denied 2019 10 10 212441 926 problem getting wiredtiger ubuntu1804 8d9f164f5cd5f69b48f786b91d5451823ae97dae artifacts compile_wiredtiger_ubuntu1804_patch_8d9f164f5cd5f69b48f786b91d5451823ae97dae_5d9fd2c09ccd4e6068b5ae4b_19_10_11_00_54_58 tgz s3 bucket retrying problem extracting wiredtiger ubuntu1804 8d9f164f5cd5f69b48f786b91d5451823ae97dae artifacts compile_wiredtiger_ubuntu1804_patch_8d9f164f5cd5f69b48f786b91d5451823ae97dae_5d9fd2c09ccd4e6068b5ae4b_19_10_11_00_54_58 tgz archive error extracting data mci a8fdeb39f8c4fd0f291cd230e61cfa52 wiredtiger open data mci a8fdeb39f8c4fd0f291cd230e61cfa52 wiredtiger git objects 1f 423e90cf0d6a88be5f2818f8df88408698d35b permission denied 2019 10 10 212456 161 problem getting wiredtiger ubuntu1804 8d9f164f5cd5f69b48f786b91d5451823ae97dae artifacts compile_wiredtiger_ubuntu1804_patch_8d9f164f5cd5f69b48f786b91d5451823ae97dae_5d9fd2c09ccd4e6068b5ae4b_19_10_11_00_54_58 tgz s3 bucket retrying problem extracting wiredtiger ubuntu1804 8d9f164f5cd5f69b48f786b91d5451823ae97dae artifacts compile_wiredtiger_ubuntu1804_patch_8d9f164f5cd5f69b48f786b91d5451823ae97dae_5d9fd2c09ccd4e6068b5ae4b_19_10_11_00_54_58 tgz archive error extracting data mci a8fdeb39f8c4fd0f291cd230e61cfa52 wiredtiger open data mci a8fdeb39f8c4fd0f291cd230e61cfa52 wiredtiger git objects 1f 423e90cf0d6a88be5f2818f8df88408698d35b permission denied 2019 10 10 212516 206 problem getting wiredtiger ubuntu1804 8d9f164f5cd5f69b48f786b91d5451823ae97dae artifacts compile_wiredtiger_ubuntu1804_patch_8d9f164f5cd5f69b48f786b91d5451823ae97dae_5d9fd2c09ccd4e6068b5ae4b_19_10_11_00_54_58 tgz s3 bucket retrying problem extracting wiredtiger ubuntu1804 8d9f164f5cd5f69b48f786b91d5451823ae97dae artifacts compile_wiredtiger_ubuntu1804_patch_8d9f164f5cd5f69b48f786b91d5451823ae97dae_5d9fd2c09ccd4e6068b5ae4b_19_10_11_00_54_58 tgz archive error extracting data mci a8fdeb39f8c4fd0f291cd230e61cfa52 wiredtiger open data mci a8fdeb39f8c4fd0f291cd230e61cfa52 wiredtiger git objects 1f 423e90cf0d6a88be5f2818f8df88408698d35b permission denied 2019 10 10 212536 229 problem getting wiredtiger ubuntu1804 8d9f164f5cd5f69b48f786b91d5451823ae97dae artifacts compile_wiredtiger_ubuntu1804_patch_8d9f164f5cd5f69b48f786b91d5451823ae97dae_5d9fd2c09ccd4e6068b5ae4b_19_10_11_00_54_58 tgz s3 bucket retrying problem extracting wiredtiger ubuntu1804 8d9f164f5cd5f69b48f786b91d5451823ae97dae artifacts compile_wiredtiger_ubuntu1804_patch_8d9f164f5cd5f69b48f786b91d5451823ae97dae_5d9fd2c09ccd4e6068b5ae4b_19_10_11_00_54_58 tgz archive error extracting data mci a8fdeb39f8c4fd0f291cd230e61cfa52 wiredtiger open data mci a8fdeb39f8c4fd0f291cd230e61cfa52 wiredtiger git objects 1f 423e90cf0d6a88be5f2818f8df88408698d35b permission denied 2019 10 10 212556 265 problem getting wiredtiger ubuntu1804 8d9f164f5cd5f69b48f786b91d5451823ae97dae artifacts compile_wiredtiger_ubuntu1804_patch_8d9f164f5cd5f69b48f786b91d5451823ae97dae_5d9fd2c09ccd4e6068b5ae4b_19_10_11_00_54_58 tgz s3 bucket retrying problem extracting wiredtiger ubuntu1804 8d9f164f5cd5f69b48f786b91d5451823ae97dae artifacts compile_wiredtiger_ubuntu1804_patch_8d9f164f5cd5f69b48f786b91d5451823ae97dae_5d9fd2c09ccd4e6068b5ae4b_19_10_11_00_54_58 tgz archive error extracting data mci a8fdeb39f8c4fd0f291cd230e61cfa52 wiredtiger open data mci a8fdeb39f8c4fd0f291cd230e61cfa52 wiredtiger git objects 1f 423e90cf0d6a88be5f2818f8df88408698d35b permission denied 2019 10 10 212556 265 finished running task commands 6m41 475088272s code;Bug;2019-10-14T23:48:43.000+0000;Open;2019-10-22T04:17:58.000+0000;Major - P3;1.0;3;2;1;0;1;28;1;0;4
