ProjectName;Key;title_desc;Type;Created;LastUpdatedStatus;LastUpdatedStatusDate;Priority;Storypoint;NumWatchers;NumComments;NumIssueLinks;NumAffectedVersions;NumFixVersions;NumChangeHistory;P;S;R
WT;WT-4071;run unit tests timestamps disabled currently build configure timestamp size0 part wiredtiger configure combinations http build wiredtiger com8080 job wiredtiger configure combinations dont run python test suite tests currently fail noformat error test_prepare03 test_prepre03 test_prepare_cursor table row subunit remotedtestcase test_prepare03 test_prepre03 test_prepare_cursor table row _stringexception traceback recent call last file mnt fast mjc wt src wiredtiger git test suite test_prepare03 py line 93 test_prepare_cursor self session prepare_transaction prepare_timestamp2a wiredtigererror operation supportederror test_las01 test_las01 test_las subunit remotedtestcase test_las01 test_las01 test_las _stringexception traceback recent call last file mnt fast mjc wt src wiredtiger git test suite test_las01 py line 149 test_las self conn set_timestamp stable_timestamp + timestamp_str 1 wiredtigererror operation supported noformat tests skipped timestamps disabled wiredtiger timestamp_build check also periodically run unit test suite build prevent regressions;Improvement;2018-05-01T05:26:55.000+0000;Closed;2018-09-24T14:31:59.000+0000;Major - P3;2.0;4;9;0;0;4;16;1;0;4
WT;WT-6009;prepare support durable history add statistic prepared updates evicted need statistic tracks many prepared updates evicted helpful near term make sure stress tests actually testing new code paths longer term interesting diagnostic probably indicates system high stress;Task;2020-04-15T00:47:00.000+0000;Closed;2020-05-06T07:06:27.000+0000;Major - P3;2.0;0;3;0;0;3;13;1;0;4
WT;WT-5897;insert benchmark 4 4 durable history merged initial report https docs google com document 1n2fbuv7jyeaevzioil6dd_1jkjz liur0kiz2uavpok edituspsharing working making useful others summary section report full description regressions conclusions based vmstat iostat data collect via helper scripts hope figure show via ftdc summary insert rate 2x 3x faster 4 4 prior durable history merge compared 4 4 durable history merge use names mo44pre mo44dh mo44dh0315 report workload insert benchmark open source dsi provide command lines benchmark used 1 client thread inserted 50m docs database fits ram tests run big cache database fits wt small cache database doesnt fit wt regression much larger small cache might related bf 16588 bf 16496;Bug;2020-03-20T16:25:37.000+0000;Closed;2020-03-31T05:11:23.000+0000;Major - P3;2.0;12;28;2;0;1;57;1;0;4
WT;WT-5897;insert benchmark 4 4 durable history merged initial report https docs google com document 1n2fbuv7jyeaevzioil6dd_1jkjz liur0kiz2uavpok edituspsharing working making useful others summary section report full description regressions conclusions based vmstat iostat data collect via helper scripts hope figure show via ftdc summary insert rate 2x 3x faster 4 4 prior durable history merge compared 4 4 durable history merge use names mo44pre mo44dh mo44dh0315 report workload insert benchmark open source dsi provide command lines benchmark used 1 client thread inserted 50m docs database fits ram tests run big cache database fits wt small cache database doesnt fit wt regression much larger small cache might related bf 16588 bf 16496;Bug;2020-03-20T16:25:37.000+0000;Closed;2020-06-01T15:25:45.000+0000;Major - P3;2.0;12;28;2;0;1;57;1;0;4
WT;WT-6349;dont truncate history store updates globally visible timestamped deletes reconciliation page part checkpoint disk key removed globally visible removing key clean history store contents cleanup taking lot time exist many keys removed data store avoid checkpoint taking lot time avoid performing disk key removal part checkpoint;Improvement;2020-06-01T02:10:38.000+0000;Closed;2020-06-18T05:51:16.000+0000;Major - P3;2.0;16;50;6;0;3;51;1;0;4
WT;WT-6349;dont truncate history store updates globally visible timestamped deletes reconciliation page part checkpoint disk key removed globally visible removing key clean history store contents cleanup taking lot time exist many keys removed data store avoid checkpoint taking lot time avoid performing disk key removal part checkpoint;Improvement;2020-06-01T02:10:38.000+0000;Closed;2020-06-30T08:23:44.000+0000;Major - P3;2.0;16;50;6;0;3;51;1;0;4
WT;WT-6068;enable tests temporarily disabled durable history development quite tests temporarily disabled test evergreen yml durable history development reduce testing noise time enable durable history projects wrapping;Technical Debt;2020-04-27T06:20:31.000+0000;Closed;2020-05-06T07:06:33.000+0000;Major - P3;2.0;1;4;0;0;3;9;1;0;4
WT;WT-4221;performance baseline non prepared transactions ticket involves running existing tests identifying regression non prepared transactions;Task;2018-08-03T03:49:59.000+0000;Closed;2018-09-24T14:31:44.000+0000;Major - P3;2.0;4;2;0;0;0;13;1;0;4
WT;WT-4185;dont remove lookaside entries reading page current cache overflow algorithm removes entries lookaside table whenever page read cache work slows reads lookaside sweep code removes entries background well stop removing inline reads need change inserts well behave correctly existing key could also play future work avoid writing lookaside table entries;Improvement;2018-07-19T07:08:28.000+0000;Closed;2018-09-24T14:32:09.000+0000;Major - P3;2.0;5;7;0;0;4;21;1;0;4
WT;WT-4667;additional wiredtiger configuration option tests luke chen reviewing compiler tests im still regularly running vs ones jenkins runs configurations im testing dont regularly test part jenkins wiredtiger pull request compilers job could test somewhere could retire part separate testing list includes disable crc32 hardware enable leveldb enable leveldbbasho enable leveldbhyper enable leveldbrocksdb enable python enable tcmalloc java spinlockgcc spinlockpthread spinlockpthread_adaptivethe compiler build currently takes 11 minutes slow part pr build dont see much point testing options every build week develop branch would sufficient could probably drop leveldb variants doubt theyre still interesting anyone;Improvement;2019-03-28T18:21:00.000+0000;Open;2020-05-11T12:59:00.000+0000;Minor - P4;2.0;3;3;0;0;1;33;0;0;7
WT;WT-6270;stop running stress tests cache size 100mb follow work wt 6197 weve running lot stress tests cache thats quite small doesnt replication production scenarios generating noise modify testing would require changing test format probably test_timestamp_abort conversation may needed decided specifically ones;Improvement;2020-05-19T06:04:55.000+0000;Open;2020-05-28T04:23:20.000+0000;Major - P3;3.0;4;5;1;0;1;15;1;1;5
WT;WT-6270;stop running stress tests cache size 100mb follow work wt 6197 weve running lot stress tests cache thats quite small doesnt replication production scenarios generating noise modify testing would require changing test format probably test_timestamp_abort conversation may needed decided specifically ones;Improvement;2020-05-19T06:04:55.000+0000;Open;2020-05-25T07:39:53.000+0000;Major - P3;3.0;4;5;1;0;1;15;1;1;5
WT;WT-6356;add asserts ensure dont see order timestamps decided remove support order timestamps support mixed mode transactions add asserts ensure;Task;2020-06-01T08:36:01.000+0000;In Progress;2020-06-01T23:49:05.000+0000;Major - P3;3.0;3;1;0;0;1;12;1;1;5
WT;WT-6525;page written requiring history store records misleading statistic page written requiring history store records could misleading update restore eviction update restore eviction saved updates list call __wt_hs_insert_updates ondisk update written write history store skipped noformat enter update boundarys list history store 0 list multi supd multi supd_entries ++i ++list onpage_upd selected dont need insert anything history store list onpage_upd null continue noformat instance following resolves issue noformat diff git src third_party wiredtiger src history hs c b src third_party wiredtiger src history hs cindex cb93b42e56 139b7ede82 100644 src third_party wiredtiger src history hs c+++ b src third_party wiredtiger src history hs c 679 7 +679 7 __hs_next_upd_full_value wt_session_impl session wt_modify_vector modifies copy one set saved updates databases history store table int __wt_hs_insert_updates wt_session_impl session wt_page page wt_multi multi +__wt_hs_insert_updates wt_session_impl session wt_page page wt_multi multi bool cache_write_hs wt_btree btree wt_cursor cursor 1035 6 +1035 9 err ret 0 insert_cnt 0 __hs_insert_updates_verbose session btree + insert_cnt 0 + cache_write_hs true + __wt_scr_free session key modify_value allocated __wt_modify_pack free allocated modify_value null diff git src third_party wiredtiger src include extern h b src third_party wiredtiger src include extern hindex 513013eab3 db02077789 100644 src third_party wiredtiger src include extern h+++ b src third_party wiredtiger src include extern h 775 7 +775 7 extern int __wt_hs_find_upd wt_session_impl session wt_item key const char wt_gcc_func_decl_attribute warn_unused_result extern int __wt_hs_get_btree wt_session_impl session wt_btree hs_btreep wt_gcc_func_decl_attribute warn_unused_result extern int __wt_hs_insert_updates wt_session_impl session wt_page page wt_multi multi +extern int __wt_hs_insert_updates wt_session_impl session wt_page page wt_multi multi bool cache_write_hs wt_gcc_func_decl_attribute warn_unused_result extern int __wt_hs_modify wt_cursor_btree hs_cbt wt_update hs_upd wt_gcc_func_decl_attribute warn_unused_result diff git src third_party wiredtiger src reconcile rec_write c b src third_party wiredtiger src reconcile rec_write cindex 1b16ddd15f 9a0e4a27e9 100644 src third_party wiredtiger src reconcile rec_write c+++ b src third_party wiredtiger src reconcile rec_write c 2277 8 +2277 7 __rec_hs_wrapup wt_session_impl session wt_reconcile r multi r multi 0 r multi_next ++multi ++i multi supd null wt_err __wt_hs_insert_updates session r page multi r cache_write_hs true + wt_err __wt_hs_insert_updates session r page multi r cache_write_hs multi supd_restore __wt_free session multi supd multi supd_entries 0 noformat noticed issue debugging wt 6509;Bug;2020-07-14T06:27:08.000+0000;Open;2020-07-14T06:27:11.000+0000;Major - P3;3.0;1;0;0;0;1;5;1;1;5
WT;WT-6556;memory leak session transaction panic error happens wiredtiger_open call recovery wiredtigerhs wt file doesnt exist connection open fails error salvage system connection close due panic error memory allocated internal transaction structures freed thus leads memory leak;Bug;2020-07-29T00:37:31.000+0000;In Progress;2020-08-21T07:21:59.000+0000;Major - P3;3.0;1;3;0;0;1;8;1;1;5
WT;WT-6556;memory leak session transaction panic error happens wiredtiger_open call recovery wiredtigerhs wt file doesnt exist connection open fails error salvage system connection close due panic error memory allocated internal transaction structures freed thus leads memory leak;Bug;2020-07-29T00:37:31.000+0000;In Progress;2020-07-29T00:46:00.000+0000;Major - P3;3.0;1;3;0;0;1;8;1;1;5
WT;WT-6032;turn mongodb 4 4 branch upgrade downgrade testing work wt 5883 merged mongodb 4 4 branch update release compatibility testing script mongodb 4 4 branch upgrade downgrade testing;Technical Debt;2020-04-21T22:00:15.000+0000;Closed;2020-05-06T07:06:29.000+0000;Minor - P4;3.0;1;4;1;0;3;9;0;1;8
WT;WT-3892;add timing_stress_for_test option lookaside cleanup lookaside file actively used mongodb making lot enhancements recently one change enhancing garbage collection lookaside file introduced interactions threads lead race conditions itd interesting add timing_stress_for_test option lookaside file usage enable testing jenkins;Improvement;2018-02-02T23:11:26.000+0000;Closed;2018-09-24T14:32:27.000+0000;Major - P3;3.0;1;6;0;0;4;24;1;1;5
WT;WT-3943;include full error message python test asserts respect test failure evergreenhttps evergreen mongodb com task_log_raw wiredtiger_macos_1012_unit_test_acc6f67c4169af3f3ba96e21089c00ef8bcafca7_18_02_26_22_43_52 0typettexttruethe error seen follows noformat 2018 02 27 074147 377 2018 02 27 074147 377 error test_compact02 test_compact02 test_compact02 table 1mb 128kb subunit remotedtestcase 2018 02 27 074147 377 test_compact02 test_compact02 test_compact02 table 1mb 128kb 2018 02 27 074147 377 2018 02 27 074147 377 _stringexception traceback recent call last 2018 02 27 074147 377 file data mci 7ceca11bc171ea5e02066ed80200ec80 wiredtiger test suite wttest py line 409 teardown 2018 02 27 074147 377 self captureerr check self 2018 02 27 074147 377 file data mci 7ceca11bc171ea5e02066ed80200ec80 wiredtiger test suite wttest py line 104 check 2018 02 27 074147 377 shortenwithellipsis contents 100 + 2018 02 27 074147 377 file usr local cellar python 2 7 13 frameworks python framework versions 2 7 lib python2 7 unittest case py line 410 fail 2018 02 27 074147 377 raise self failureexception msg 2018 02 27 074147 377 assertionerror unexpected error output contains 1519722555945042 6980x7fffb8adb3c0 test_compact02 test_compact02 test_compact02 table 1mb 1 2018 02 27 074147 377 noformat assertion truncated error message long enough determine cause instance required us fetch core debug error awesome include information obvious assertion went wrong;Improvement;2018-02-28T01:12:56.000+0000;Closed;2018-07-18T23:15:59.000+0000;Major - P3;3.0;3;10;0;0;4;26;1;1;5
WT;WT-4104;fix test format failure comparing data content berkeley db http build wiredtiger com8080 job wiredtiger test race condition stress sanitizer 25523 console noformat nextprev wt_cursor next key mismatchbdb key 0000248716 07 opqrstu wt key 0000242940 00 opqrstuvwxyzabcdef bdb value 0000248716 lmnopqrstuvwxyzabcdefghijk wt value 0000242940 lmnopqrstuvwxyzabcdefghijklmnopqrstuvwxyzabcdefghijklmnopqrstuvwxyzabcdefghijklmnopqrstuvwxyzabcdefghijklmnopqrstuvwxyzabcdefghijklmnopqrstuvwxyzabcdefghijklmnopqrstuvwxyzabcdefghijklmnopqrstuvwxyzabcdefghijklmnopqrstuvwxyzabcdefghijklmnopqrstuvwxyzabcdefghijklmnopqrstuvwxyzabcdefghijklmnopqrstuvwxyzabcdefghijklmnopqrstuvwxyzabcdefghijklmnopqrstuvwxyzabcdefghijklmnopqrstuvwxyzabcdefghijklmnopqrstuvwxyzabcdefghijklmnopqrstuvwxyzabcdefghijklmnopqrstuvwxyzabcdefghijklmnopqrstuvwxyzabcdefghijklmnopqrstuvwxyzabcdefghijklmnopqrstuvwxyzabcdefghijklmnopqr process 37584############################################# run parameters############################################abort0alter0auto_throttle1backups0bitcnt4bloom1bloom_bit_count13bloom_hash_count4bloom_oldest0cache52cache_minimum20checkpointsoncheckpoint_log_size24checkpoint_wait16checksumoffchunk_size4compaction0compressionnonedata_extend0data_sourcetabledelete_pct6dictionary0direct_io0encryptionnoneevict_max4file_typerow storefirstfit0huffman_key0huffman_value0independent_thread_rng1in_memory0insert_pct3internal_key_truncation1internal_page_max17isolationrandomkey_gap2key_max120key_min16leaf_page_max15leak_memory0logging1logging_archive0logging_compressionsnappylogging_file_max50964logging_prealloc1long_running_txn0lsm_worker_threads4merge_max19mmap1modify_pct0ops0prefix_compression0prefix_compression_min7prepare0quiet1read_pct90rebalance1repeat_data_pct78reverse0rows1000000runs1salvage1split_pct67statistics0statistics_server1threads1timer4timing_stress_checkpoint0timing_stress_lookaside_sweep0timing_stress_split_10timing_stress_split_21timing_stress_split_31timing_stress_split_40timing_stress_split_51timing_stress_split_61timing_stress_split_71transaction_timestamps0transaction frequency67truncate1value_max1366value_min20verify1wiredtiger_configwrite_pct1############################################ noformat;Bug;2018-05-29T10:41:32.000+0000;Closed;2018-09-24T14:32:29.000+0000;Major - P3;3.0;6;19;1;0;4;35;1;1;5
WT;WT-4111;improve checkpoint scrubbing algorithm intent scrub phase checkpoints reduce much content checkpoint needs flush disk scrubbing many different workloads deal two extremes define bounds algorithm needs work within 1 large caches low volume writes type workload pre flushing dirty content makes checkpoints much less disruptive operations primary target scrubbing 2 high throughput write workloads case little hope reducing amount content checkpoint needs write since workload dirties data much faster flushed disk situation scrubbing isnt useful weve seen applications spend significant time scrubbing suffering reduced workload throughput consequence without scrubbing materially reducing amount work checkpoint give scrubbing heuristic handle case effective extreme cases getting heuristic correct difficult given interesting change scrubbing works moment steps eviction target maximum threshold lower value co opts threads eviction work could instead look workloads similar 1 reducing eviction trigger lower bound measuring whether scrubbing makes progress reducing cache usage suppose change remain effective workloads like 1 significantly reducing cost scrubbing workloads like 2;Improvement;2018-06-06T06:55:50.000+0000;Closed;2018-09-24T14:32:06.000+0000;Major - P3;3.0;11;7;0;0;4;23;1;1;5
WT;WT-5548;enable skipped rollback stable tests variable columnar storage types fix commented rollback stable test columnar storage types enable;Task;2020-02-07T11:19:22.000+0000;Open;2020-02-07T11:19:28.000+0000;Major - P3;3.0;2;4;1;0;1;19;1;1;5
WT;WT-5550;handle moving modify type update history store data store variable columnar types create full update similar like row modify needs done columnar modify also;Task;2020-02-07T11:22:31.000+0000;Open;2020-02-07T11:22:38.000+0000;Major - P3;3.0;0;0;0;0;1;23;1;1;5
WT;WT-5679;set oldest history store checkpoint timestamp oldest timestamp restart durable history wt doesnt maintain history window values restart durable history possible retain history window currently history window retained setting oldest_timestamp 0 instead actual oldest_timestamp value required history window user setting oldest timestamp wt traverse list checkpoints history store use oldest checkpoint timestamp minimum valid timestamp;Task;2020-02-26T03:32:01.000+0000;Closed;2020-08-17T21:32:54.000+0000;Major - P3;3.0;6;16;4;0;0;38;1;1;5
WT;WT-5679;set oldest history store checkpoint timestamp oldest timestamp restart durable history wt doesnt maintain history window values restart durable history possible retain history window currently history window retained setting oldest_timestamp 0 instead actual oldest_timestamp value required history window user setting oldest timestamp wt traverse list checkpoints history store use oldest checkpoint timestamp minimum valid timestamp;Task;2020-02-26T03:32:01.000+0000;Closed;2020-06-01T03:06:56.000+0000;Major - P3;3.0;6;16;4;0;0;38;1;1;5
WT;WT-5720;stable timestamp unset oldest timestamp set debugging wt 5655 noticed following statement allows one oldest timestamp without stable timestamp noformat oldest stable timestamps must always satisfy condition oldest stable has_oldest has_stable has_oldest txn_global has_oldest_timestamp has_stable txn_global has_stable_timestamp oldest_ts stable_ts __wt_readunlock session txn_global rwlock wt_ret_msg session einval set_timestamp oldest timestamp must later stable timestamp __wt_timestamp_to_string oldest_ts ts_string 0 __wt_timestamp_to_string stable_ts ts_string 1 gdb p wt_connection_impl session iface connection txn_global17 current 68200 last_running 68200 oldest_id 68200 durable_timestamp 112793 last_ckpt_timestamp 0 meta_ckpt_timestamp 0 oldest_timestamp 93921 pinned_timestamp 93921 recovery_timestamp 0 stable_timestamp 0 has_durable_timestamp true noformat instead fixing use oldest timestamp stable timestamp possible act user set stable timestamp;Bug;2020-03-02T23:33:49.000+0000;Open;2020-03-02T23:33:50.000+0000;Major - P3;3.0;2;2;0;0;1;20;1;1;5
WT;WT-5949;define new page flag type represent disk image shouldnt freed count cache usage create new type use type places page flags passed function __wt_page_inmem function adjusts places use newly defined type;Task;2020-03-31T04:05:55.000+0000;Open;2020-05-05T05:43:45.000+0000;Major - P3;3.0;3;6;0;0;1;24;1;1;5
WT;WT-5429;performance test measure rollback stable without recovery compared develop version execute designed performance test find overhead compared earlier version recovery rollback stable operation impact rollback stable server startup needs measured following cases rollback stable remove updates datastore plus history store rollback stable remove half updates data store replacing data history store rollback stable doesnt remove data checkpointed data stable perform operations another set logged tables parallel rts impact startup performance test find much impacts based scenarios;Task;2020-01-13T05:50:44.000+0000;Open;2020-01-13T05:50:49.000+0000;Major - P3;3.0;2;1;0;0;1;12;1;1;5
WT;WT-4125;ensure subsequent checkpoints stable timestamp dont read much create python test case holds back stable timestamp inserts bunch data creates checkpoint inserts little data creates new checkpoint second checkpoint enough review content updated since previous checkpoint;Improvement;2018-06-13T01:07:49.000+0000;Closed;2018-09-24T14:30:06.000+0000;Major - P3;3.0;8;8;3;0;4;28;1;1;5
WT;WT-4134;rework assertion dont discard required history assertion finished evicting page seen fire testing code 2018 05 30t232140 880+0000 e storage thread17 wiredtiger error 0 1527722500880252 397460x3fff9942ee30 filecollection 31 7788036076520929582 wt eviction server __evict_review 670 __wt_page_is_modified page __wt_txn_visible_all session page modify rec_max_txn wt_timestamp_null page modify rec_max_timestamp 2018 05 30t232140 880+0000 e storage thread17 wiredtiger error 0 1527722500880396 397460x3fff9942ee30 filecollection 31 7788036076520929582 wt eviction server aborting wiredtiger library code comment describing assertion code page clean assert reconciliation configured lookaside table durable object currently lookaside table page updates globally visible code doesnt match actual assertion code wt_assert session __wt_page_is_modified page __wt_txn_visible_all session page modify rec_max_txn wt_timestamp_null page modify rec_max_timestamp code believe add check lookaside eviction code wt_assert session __wt_page_is_modified page lf_isset wt_rec_lookaside __wt_txn_visible_all session page modify rec_max_txn wt_timestamp_null page modify rec_max_timestamp code ok evict clean page necessary history history written lookaside;Improvement;2018-06-18T23:29:31.000+0000;Closed;2018-09-24T14:31:52.000+0000;Major - P3;3.0;3;6;0;0;4;17;1;1;5
WT;WT-4323;fix race setting transaction read_timestamp updating global pinned timestamp updating oldest_timestamp also txn_update_pinned_timestamp fetch https github com wiredtiger wiredtiger blob d7a42128c95564f2545c4170c64bfb430857115b src txn txn_timestamp c#l421 current pinned timestamp validations write lock update https github com wiredtiger wiredtiger blob d7a42128c95564f2545c4170c64bfb430857115b src txn txn_timestamp c#l442 txn_global pinned_timestamp possible time fetch update actual pinned timestamp moved backward due new transaction read_timestamp older current pinned timestamp new transaction began successfully started oldest_timestamp update thread butthe transaction commit rollback would fail would see pinned ahead transactions read_timestamp;Bug;2018-09-17T05:30:15.000+0000;Closed;2018-09-24T14:31:41.000+0000;Major - P3;3.0;5;7;1;1;3;19;1;1;5
