ProjectName;Key;title_desc;Type;Created;LastUpdatedStatus;LastUpdatedStatusDate;Priority;Storypoint;NumWatchers;NumComments;NumIssueLinks;NumAffectedVersions;NumFixVersions;NumChangeHistory;P;S;R
WT;WT-4018;checkpoint integrity test indicates macos 10 13 fsync bug paneltitleissue status nov 08 2018 bordercolor#cccccc titlebgcolor#6cb33f bgcolor#eeeeee issue summary mongodb 4 0+ may lose data unclean shutdowns macos 10 12+ please see wt 4112 additional information user impact potential data corruption server shutdown properly workarounds raised issue macos team apple properly addressed issue part macos 10 14 1 affected versions mongodb production releases 4 0+ affected issue fix version noneresolution details issue resolved part macos 10 14 1 running 10 14 1 later issue fixed panel tried patch build wiredtiger new macos 10 13 test machine failed described https evergreen mongodb com task wiredtiger_macos_1013_compile_patch_0ed8dfb2d9e29d5941527f25f30a308b3d167c81_5ac59fdee3c3314977bb6a25_18_04_05_04_02_44 noformat 2018 04 05 142348 491 fail test_wt2909_checkpoint_integrity 2018 04 05 142348 491 2018 04 05 142348 491 1522902060884671 892680x7fffad0c8340 filesubtest wt wt_cursor next read checksum error 28672b block offset 54935552 block header checksum 0 doesnt match expected checksum 4276936668 2018 04 05 142348 491 1522902060884910 892680x7fffad0c8340 filesubtest wt wt_cursor next 54935552 28672 4276936668 chunk 1 28 00 00 00 00 00 00 00 00 00 00 00 00 00 00 00 00 00 00 00 00 00 00 00 00 00 00 00 00 00 00 00 00 00 00 00 00 00 00 00 00 00 00 00 00 00 00 00 00 00 00 00 00 00 00 00 00 00 00 00 00 00 00 00 00 00 00 00 00 00 00 00 00 00 00 00 00 00 00 00 00 00 00 00 00 00 00 00 00 00 00 00 00 00 00 00 00 00 00 00 00 00 00 00 00 00 00 00 00 00 00 00 00 00 00 00 00 00 00 00 00 00 00 00 00 00 00 00 00 00 00 00 00 00 00 00 00 00 00 00 00 00 00 00 00 00 00 00 00 00 00 00 00 00 00 00 00 00 00 00 00 00 00 00 00 00 00 00 00 00 00 00 00 00 00 00 00 00 00 00 00 00 00 00 00 00 00 00 00 00 00 00 00 00 00 00 00 00 00 00 00 00 00 00 00 00 00 00 00 00 00 00 00 00 00 00 00 00 00 00 00 00 00 00 00 00 00 00 00 00 00 00 00 00 00 00 00 00 00 00 00 00 00 00 00 00 00 00 00 00 00 00 00 00 00 00 00 00 00 00 00 00 00 00 00 00 00 00 00 00 00 00 00 00 00 00 00 00 00 00 00 00 00 00 00 00 00 00 00 00 00 00 00 00 00 00 00 00 00 00 00 00 00 00 00 00 00 00 00 00 00 00 00 00 00 00 00 00 00 00 00 00 00 00 00 00 00 00 00 00 00 00 00 00 00 00 00 00 00 00 00 00 00 00 00 00 00 00 00 00 00 00 00 00 00 00 00 00 00 00 00 00 00 00 00 00 00 00 00 00 00 00 00 00 00 00 00 00 00 00 00 00 00 00 00 00 00 00 00 00 00 00 00 00 00 00 00 00 00 00 00 00 00 00 00 00 00 00 00 00 00 00 00 00 00 00 00 00 00 00 00 00 00 00 00 00 00 00 00 00 00 00 00 00 00 00 00 00 00 00 00 00 00 00 00 00 00 00 00 00 00 00 00 00 00 00 00 00 00 00 00 00 00 00 00 00 00 00 00 00 00 00 00 00 00 00 00 00 00 00 00 00 00 00 00 00 00 00 00 00 00 00 00 00 00 00 00 00 00 00 00 00 00 00 00 00 00 00 00 00 00 00 00 00 00 00 00 00 00 00 00 00 00 00 00 00 00 00 00 00 00 00 00 00 00 00 00 00 00 00 00 00 00 00 00 00 00 00 00 00 00 00 00 00 00 00 00 00 00 00 00 00 00 00 00 00 00 00 00 00 00 00 00 00 00 00 00 00 00 00 00 00 00 00 00 00 00 00 00 00 00 00 00 00 00 00 00 00 00 00 00 00 00 00 00 00 00 00 00 00 00 00 00 00 00 00 00 00 00 00 00 00 00 00 00 00 00 00 00 00 00 00 00 00 00 00 00 00 00 00 00 00 00 00 00 00 00 00 00 00 00 00 00 00 00 00 00 00 00 00 00 00 00 00 00 00 00 00 00 00 00 00 00 00 00 00 00 00 00 00 00 00 00 00 00 00 00 00 00 00 00 00 00 00 00 00 00 00 00 00 00 00 00 00 00 00 00 00 00 00 00 00 00 00 00 00 00 00 00 00 00 00 00 00 00 00 00 00 00 00 00 00 00 00 00 00 00 00 00 00 00 00 00 00 00 00 00 00 00 00 00 00 00 00 00 00 00 00 00 00 00 00 00 00 00 00 00 00 00 00 00 00 00 00 00 00 00 00 00 00 00 00 00 00 00 00 00 00 00 00 00 00 00 00 00 00 00 00 00 00 00 00 00 00 00 00 00 00 00 00 00 00 00 00 00 00 00 00 00 00 00 00 00 00 00 00 00 00 00 00 00 00 00 00 00 00 00 00 00 00 00 00 00 00 00 00 00 00 00 00 00 00 00 00 00 00 00 00 00 00 00 00 00 00 00 00 00 00 00 00 00 00 00 00 00 00 00 00 00 00 00 00 00 00 00 00 00 00 00 00 00 00 00 00 00 00 00 00 00 00 00 00 00 00 00 00 00 00 00 00 00 00 00 00 00 00 00 00 00 00 00 00 00 00 00 00 00 00 00 00 00 00 00 00 00 00 00 00 00 00 00 00 00 00 00 00 00 00 00 00 00 00 00 00 00 00 00 00 00 00 00 00 00 00 00 00 00 00 00 00 00 00 00 00 00 00 00 00 00 00 00 00 00 00 00 00 00 00 00 00 00 00 00 00 00 00 00 00 00 00 00 00 00 00 00 00 00 00 00 00 00 00 00 00 00 00 00 00 00 00 00 00 00 00 00 2018 04 05 142348 491 1522902060885080 892680x7fffad0c8340 filesubtest wt wt_cursor next 54935552 28672 4276936668 chunk 2 28 00 00 00 00 00 00 00 00 00 00 00 00 00 00 00 00 00 00 00 00 00 00 00 00 00 00 00 00 00 00 00 00 00 00 00 00 00 00 00 00 00 00 00 00 00 00 00 00 00 00 00 00 00 00 00 00 00 00 00 00 00 00 00 00 00 00 00 00 00 00 00 00 00 00 00 00 00 00 00 00 00 00 00 00 00 00 00 00 00 00 00 00 00 00 00 00 00 00 00 00 00 00 00 00 00 00 00 00 00 00 00 00 00 00 00 00 00 00 00 00 00 00 00 00 00 00 00 00 00 00 00 00 00 00 00 00 00 00 00 00 00 00 00 00 00 00 00 00 00 00 00 00 00 00 00 00 00 00 00 00 00 00 00 00 00 00 00 00 00 00 00 00 00 00 00 00 00 00 00 00 00 00 00 00 00 00 00 00 00 00 00 00 00 00 00 00 00 00 00 00 00 00 00 00 00 00 00 00 00 00 00 00 00 00 00 00 00 00 00 00 00 00 00 00 00 00 00 00 00 00 00 00 00 00 00 00 00 00 00 00 00 00 00 00 00 00 00 00 00 00 00 00 00 00 00 00 00 00 00 00 00 00 00 00 00 00 00 00 00 00 00 00 00 00 00 00 00 00 00 00 00 00 00 00 00 00 00 00 00 00 00 00 00 00 00 00 00 00 00 00 00 00 00 00 00 00 00 00 00 00 00 00 00 00 00 00 00 00 00 00 00 00 00 00 00 00 00 00 00 00 00 00 00 00 00 00 00 00 00 00 00 00 00 00 00 00 00 00 00 00 00 00 00 00 00 00 00 00 00 00 00 00 00 00 00 00 00 00 00 00 00 00 00 00 00 00 00 00 00 00 00 00 00 00 00 00 00 00 00 00 00 00 00 00 00 00 00 00 00 00 00 00 00 00 00 00 00 00 00 00 00 00 00 00 00 00 00 00 00 00 00 00 00 00 00 00 00 00 00 00 00 00 00 00 00 00 00 00 00 00 00 00 00 00 00 00 00 00 00 00 00 00 00 00 00 00 00 00 00 00 00 00 00 00 00 00 00 00 00 00 00 00 00 00 00 00 00 00 00 00 00 00 00 00 00 00 00 00 00 00 00 00 00 00 00 00 00 00 00 00 00 00 00 00 00 00 00 00 00 00 00 00 00 00 00 00 00 00 00 00 00 00 00 00 00 00 00 00 00 00 00 00 00 00 00 00 00 00 00 00 00 00 00 00 00 00 00 00 00 00 00 00 00 00 00 00 00 00 00 00 00 00 00 00 00 00 00 00 00 00 00 00 00 00 00 00 00 00 00 00 00 00 00 00 00 00 00 00 00 00 00 00 00 00 00 00 00 00 00 00 00 00 00 00 00 00 00 00 00 00 00 00 00 00 00 00 00 00 00 00 00 00 00 00 00 00 00 00 00 00 00 00 00 00 00 00 00 00 00 00 00 00 00 00 00 00 00 00 00 00 00 00 00 00 00 00 00 00 00 00 00 00 00 00 00 00 00 00 00 00 00 00 00 00 00 00 00 00 00 00 00 00 00 00 00 00 00 00 00 00 00 00 00 00 00 00 00 00 00 00 00 00 00 00 00 00 00 00 00 00 00 00 00 00 00 00 00 00 00 00 00 00 00 00 00 00 00 00 00 00 00 00 00 00 00 00 00 00 00 00 00 00 00 00 00 00 00 00 00 00 00 00 00 00 00 00 00 00 00 00 00 00 00 00 00 00 00 00 00 00 00 00 00 00 00 00 00 00 00 00 00 00 00 00 00 00 00 00 00 00 00 00 00 00 00 00 00 00 00 00 00 00 00 00 00 00 00 00 00 00 00 00 00 00 00 00 00 00 00 00 00 00 00 00 00 00 00 00 00 00 00 00 00 00 00 00 00 00 00 00 00 00 00 00 00 00 00 00 00 00 00 00 00 00 00 00 00 00 00 00 00 00 00 00 00 00 00 00 00 00 00 00 00 00 00 00 00 00 00 00 00 00 00 00 00 00 00 00 00 00 00 00 00 00 00 00 00 00 00 00 00 00 00 00 00 00 00 00 00 00 00 00 00 00 00 00 00 00 00 00 00 00 00 00 00 00 00 00 00 00 00 00 00 00 00 00 00 00 00 00 00 00 00 00 00 00 00 00 00 00 00 00 00 00 00 00 00 00 00 00 00 00 00 00 00 00 00 00 00 00 00 00 00 00 00 00 00 00 00 00 00 00 00 00 00 00 00 00 00 00 00 00 00 00 00 00 00 00 00 00 00 00 00 00 00 00 00 00 00 00 00 00 00 00 00 00 00 00 00 00 00 00 00 00 2018 04 05 142348 492 1522902060889392 892680x7fffad0c8340 filesubtest wt wt_cursor next 54935552 28672 4276936668 chunk 28 28 00 00 00 00 00 00 00 00 00 00 00 00 00 00 00 00 00 00 00 00 00 00 00 00 00 00 00 00 00 00 00 00 00 00 00 00 00 00 00 00 00 00 00 00 00 00 00 00 00 00 00 00 00 00 00 00 00 00 00 00 00 00 00 00 00 00 00 00 00 00 00 00 00 00 00 00 00 00 00 00 00 00 00 00 00 00 00 00 00 00 00 00 00 00 00 00 00 00 00 00 00 00 00 00 00 00 00 00 00 00 00 00 00 00 00 00 00 00 00 00 00 00 00 00 00 00 00 00 00 00 00 00 00 00 00 00 00 00 00 00 00 00 00 00 00 00 00 00 00 00 00 00 00 00 00 00 00 00 00 00 00 00 00 00 00 00 00 00 00 00 00 00 00 00 00 00 00 00 00 00 00 00 00 00 00 00 00 00 00 00 00 00 00 00 00 00 00 00 00 00 00 00 00 00 00 00 00 00 00 00 00 00 00 00 00 00 00 00 00 00 00 00 00 00 00 00 00 00 00 00 00 00 00 00 00 00 00 00 00 00 00 00 00 00 00 00 00 00 00 00 00 00 00 00 00 00 00 00 00 00 00 00 00 00 00 00 00 00 00 00 00 00 00 00 00 00 00 00 00 00 00 00 00 00 00 00 00 00 00 00 00 00 00 00 00 00 00 00 00 00 00 00 00 00 00 00 00 00 00 00 00 00 00 00 00 00 00 00 00 00 00 00 00 00 00 00 00 00 00 00 00 00 00 00 00 00 00 00 00 00 00 00 00 00 00 00 00 00 00 00 00 00 00 00 00 00 00 00 00 00 00 00 00 00 00 00 00 00 00 00 00 00 00 00 00 00 00 00 00 00 00 00 00 00 00 00 00 00 00 00 00 00 00 00 00 00 00 00 00 00 00 00 00 00 00 00 00 00 00 00 00 00 00 00 00 00 00 00 00 00 00 00 00 00 00 00 00 00 00 00 00 00 00 00 00 00 00 00 00 00 00 00 00 00 00 00 00 00 00 00 00 00 00 00 00 00 00 00 00 00 00 00 00 00 00 00 00 00 00 00 00 00 00 00 00 00 00 00 00 00 00 00 00 00 00 00 00 00 00 00 00 00 00 00 00 00 00 00 00 00 00 00 00 00 00 00 00 00 00 00 00 00 00 00 00 00 00 00 00 00 00 00 00 00 00 00 00 00 00 00 00 00 00 00 00 00 00 00 00 00 00 00 00 00 00 00 00 00 00 00 00 00 00 00 00 00 00 00 00 00 00 00 00 00 00 00 00 00 00 00 00 00 00 00 00 00 00 00 00 00 00 00 00 00 00 00 00 00 00 00 00 00 00 00 00 00 00 00 00 00 00 00 00 00 00 00 00 00 00 00 00 00 00 00 00 00 00 00 00 00 00 00 00 00 00 00 00 00 00 00 00 00 00 00 00 00 00 00 00 00 00 00 00 00 00 00 00 00 00 00 00 00 00 00 00 00 00 00 00 00 00 00 00 00 00 00 00 00 00 00 00 00 00 00 00 00 00 00 00 00 00 00 00 00 00 00 00 00 00 00 00 00 00 00 00 00 00 00 00 00 00 00 00 00 00 00 00 00 00 00 00 00 00 00 00 00 00 00 00 00 00 00 00 00 00 00 00 00 00 00 00 00 00 00 00 00 00 00 00 00 00 00 00 00 00 00 00 00 00 00 00 00 00 00 00 00 00 00 00 00 00 00 00 00 00 00 00 00 00 00 00 00 00 00 00 00 00 00 00 00 00 00 00 00 00 00 00 00 00 00 00 00 00 00 00 00 00 00 00 00 00 00 00 00 00 00 00 00 00 00 00 00 00 00 00 00 00 00 00 00 00 00 00 00 00 00 00 00 00 00 00 00 00 00 00 00 00 00 00 00 00 00 00 00 00 00 00 00 00 00 00 00 00 00 00 00 00 00 00 00 00 00 00 00 00 00 00 00 00 00 00 00 00 00 00 00 00 00 00 00 00 00 00 00 00 00 00 00 00 00 00 00 00 00 00 00 00 00 00 00 00 00 00 00 00 00 00 00 00 00 00 00 00 00 00 00 00 00 00 00 00 00 00 00 00 00 00 00 00 00 00 00 00 00 00 00 00 00 00 00 00 00 00 00 00 00 00 00 00 00 00 00 00 00 00 00 00 00 00 00 00 00 00 00 00 00 00 00 00 00 00 00 00 00 00 00 00 00 00 00 00 00 00 00 00 00 00 00 00 00 00 00 00 00 00 00 00 00 00 00 00 00 00 00 00 00 00 00 00 00 00 00 00 00 00 00 00 00 00 00 00 00 00 00 2018 04 05 142348 492 1522902060889424 892680x7fffad0c8340 filesubtest wt wt_cursor next subtest wt encountered illegal file format internal value __wt_block_read_off 302 2018 04 05 142348 492 1522902060889435 892680x7fffad0c8340 filesubtest wt wt_cursor next process must exit restart wt_panic wiredtiger library panic 2018 04 05 142348 492 1522902060889445 892680x7fffad0c8340 filesubtest wt wt_cursor next aborting wiredtiger library 2018 04 05 142348 492 fail test_wt2909_checkpoint_integrity exit status 134 noformat;Bug;2018-04-05T06:08:49.000+0000;Closed;2018-09-24T14:32:36.000+0000;Major - P3;8.0;17;9;3;0;0;33;1;2;6
WT;WT-4010;simplify test format timestamp handling current implementation test format tracks active timestamps order able choose legal read timestamp operations tracking complex addition prepare support requires co ordinating timestamp allocation via lock test format could instead query wiredtiger via wt_connectionquery_timestamp api retrieve legal read timestamp wouldnt need complex co ordination code;Improvement;2018-04-04T03:00:23.000+0000;Closed;2018-09-24T14:32:44.000+0000;Major - P3;5.0;6;21;1;0;4;30;1;2;6
WT;WT-4004;test format snapshot isolation search mismatch failure zseries format failurehttp build wiredtiger com8080 job wiredtiger test format stress zseries 41825 console michael cahill im little suspicious wt 3981 merged hours noformat snapshot isolation 0000093160 00 opqrstuvwxyz search mismatchexpected 0000093160 lmnopqrstuvwxyzabcdefghijklmnopqrstuvwxyz found deleted ############################################# run parameters############################################abort0alter0auto_throttle1backups0bitcnt7bloom1bloom_bit_count5bloom_hash_count29bloom_oldest0cache65cache_minimum20checkpointsoffcheckpoint_log_size54checkpoint_wait35checksumuncompressedchunk_size6compaction0compressionnonedata_extend0data_sourcetabledelete_pct87dictionary0direct_io0encryptionrotn 7evict_max3file_typerow storefirstfit0huffman_key0huffman_value0independent_thread_rng1in_memory1insert_pct3internal_key_truncation1internal_page_max12isolationsnapshotkey_gap17key_max32key_min14leaf_page_max10leak_memory0logging0logging_archive0logging_compressionzliblogging_file_max501851logging_prealloc0long_running_txn0lsm_worker_threads3merge_max12mmap1modify_pct9ops100000prefix_compression1prefix_compression_min5quiet1read_pct1rebalance0repeat_data_pct79reverse0rows100000runs100salvage0split_pct64statistics0statistics_server0threads16timer360transaction_timestamps1transaction frequency42truncate1value_max80value_min6verify0wiredtiger_configwrite_pct0############################################ noformat;Bug;2018-03-28T10:44:49.000+0000;Closed;2018-09-24T14:31:57.000+0000;Major - P3;8.0;5;20;1;0;3;34;1;2;6
WT;WT-4000;avoid getting two snapshots setting read_timestamp wt 3981 get new transaction snapshot setting read_timestamp running transaction means pattern code session begin_transaction isolationsnapshot session timestamp_transaction read_timestampx code calls __wt_txn_get_snapshot twice find way avoid one calls making sure snapshot current timestamp_transaction call correctness setting read timestamp relatively common case getting snapshot expensive many sessions active;Improvement;2018-03-27T05:50:32.000+0000;Closed;2018-09-24T14:30:05.000+0000;Major - P3;5.0;5;9;1;0;3;14;1;2;6
WT;WT-3992;eviction thread freeing ref page_del race with__wt_page_can_evict __wt_page_can_evictessentially using ref page_del null ref page_del txnid wt_txn_aborted proxy wt_ref state wt_ref_deleted dont completely understand importantly dont think test safe dont page locked race another thread freeing ref page_del part evicting page think move test __evict_review done lock page im correct code __wt_delete_page_rollback probably play well code done mark truncate aborted must come last point nothing preventing page evicted ref page_del state wt_update_state_ready wt_publish ref page_del txnid wt_txn_aborted return 0 code guess setting page_del txnid wt_txn_aborted would longer useful id want stare minutes making change;Task;2018-03-26T01:23:56.000+0000;Closed;2018-09-24T14:32:13.000+0000;Major - P3;5.0;5;11;0;0;0;30;1;2;6
WT;WT-4763;setup process periodically run clang tidy scan added scripts clangs static analysis tools scan tidy wt 3819 didnt create process regularly get run results evaluated isnt easy seems dont get clean runs tools output isnt necessarily empty success probably requires human evaluation way detect change output last successful run;Technical Debt;2019-05-06T17:39:43.000+0000;Open;2019-05-06T17:39:44.000+0000;Major - P3;5.0;0;0;0;0;1;12;1;2;6
WT;WT-4798;fix bug picking random dhandle eviction changes wt 4732 introduced mechanism pick dhandles randomly eviction done avoid following specific pattern choosing dhandles hence fair eviction policy dhandles maintained global dhandle list well hash table fixed size buckets 512 bucket containing list dhandles hash collides bucket change wt 4732 supposed following1 less certain number dhandles walk global list random dhandle2 large number dhandles pick random dhandle bucket pick random dhandle buckets dhandle list changes introduced bug step 2 picking random bucket say n dhandles list instead picking random dhandle among n would pick random dhandle next n global list hence limiting eviction small subset dhandles global list bug leads eviction servers inability find pages evict eventually cache gets full workload stalls;Bug;2019-05-17T00:52:18.000+0000;Closed;2019-06-17T14:41:30.000+0000;Major - P3;8.0;15;6;3;0;3;54;1;2;6
WT;WT-5061;minor hot backup cursor cleanup minor hot backup cursor cleanup;Bug;2019-08-14T01:19:13.000+0000;Closed;2019-08-14T14:28:31.000+0000;Major - P3;5.0;0;0;0;0;0;2;1;2;6
WT;WT-5107;update wiredtiger python formatting linting standard match mongodb recent python formatting linting update made mongodb repo build test related scripts see quoted announcement details wiredtiger team decided apply standard wiredtiger repo would great incorporate format checking script dist directory covered existing checking command without overhead remember running separate new script committing code noformat tldr commit server 23312 enabled python formatting via yapf linting py files buildscripts pytests also updated linters create modify python files impact use scons lint need ensure python environment latest linters update python linters using following commandspip2 install r pytests requirements txtpip2 install r buildscripts requirements txtpip3 install r buildscripts requirements txtif create modify python files directories need format lint commit directly format lint using following commands format lint files python buildscripts pylinters py fixpython buildscripts pylinters py lintthere options choose usepython2 buildscripts pylinters py helpusage pylinters py h yapf linter_yapf pylint linter_pylint pydocstyle linter_pydocstyle mypy linter_mypy linters linters v lint lint lint patch fix pylinter frontend optional arguments h help show help message exit yapf linter_yapf path linter yapf pylint linter_pylint path linter pylint pydocstyle linter_pydocstyle path linter pydocstyle mypy linter_mypy path linter mypy linters linters comma separated list filters use defaults v verbose enable verbose logginglinter subcommands lint lint lint patch fix sub command help lint lint git files lint lint files lint patch lint files patch fix fix files possible noformat;Improvement;2018-04-16T04:26:37.000+0000;Open;2019-09-05T23:50:13.000+0000;Major - P3;5.0;5;4;2;0;1;53;1;2;6
WT;WT-5867;ensure tombstones generated 4 4 dont resurrect 4 2 scenario running changes durable history write value data file stop timestamp removed remove isnt globally visible user starts using database mongodb 4 2 believe ignore timestamps altogether thus value become visible startup writing ive realised rollback_to_stable clean shutdown might fix confirm testing least;Bug;2020-03-17T05:45:06.000+0000;Closed;2020-03-19T00:11:52.000+0000;Major - P3;5.0;7;13;0;0;0;10;1;2;6
WT;WT-5848;analyse test replica_sets_kill_primary_jscore_passthrough failure failure logs noformat js_testwildcard_index_distinct_scan 2020 03 15t101557 818+0000 2020 03 15t101557 818z network 4333208 replicasetmonitor taskexecutor rsm setname host selection timeout status attr setnamers statusfailedtosatisfyreadpreference could find host matching read preference mode primary tags set rs js_testwildcard_index_distinct_scan 2020 03 15t101557 818+0000 2020 03 15t101557 818z query 22791 js failed end session lsid due status attr lsid id uuidacab7762 0932 4d21 9119 cb029983165b status code133 codenamefailedtosatisfyreadpreference errmsgcould find host matching read preference mode primary tags set rs noformat;Bug;2020-03-15T21:13:07.000+0000;Closed;2020-03-16T00:57:38.000+0000;Major - P3;5.0;2;0;1;0;0;10;1;2;6
WT;WT-5841;return wt_try_salvage history file removed truncated wt 5831 provided temporary fix test_txn19 fix test properly also return wt_try_salvage history file removed truncated remove special handling cases test;Improvement;2020-03-13T02:16:33.000+0000;Closed;2020-05-06T07:06:18.000+0000;Major - P3;5.0;1;5;4;0;3;21;1;2;6
WT;WT-5839;ignore non globally visible tombstones data store hs store hs verification h2 format stress sanitizer test failed ubuntu 18 04 stress tests https evergreen mongodb com task wiredtiger_ubuntu1804_stress_tests_format_stress_sanitizer_test_eafea0553b62dead6c5f7338344e5ff1b1cea6a5_20_03_11_22_34_49 0 host ec2 100 26 240 166 compute 1 amazonaws com https evergreen mongodb com host 07cdf4efd29fcea88 project wiredtiger develop https evergreen mongodb com waterfall wiredtiger commit diff https github com wiredtiger wiredtiger commit eafea0553b62dead6c5f7338344e5ff1b1cea6a5 wt 5806 perform rollback stable clean shutdown #5385 perform rollback stable operation clean shutdownto ensure stable version written disk thatthe database used downgraded version also removed old connection eviction hs flag 11 mar 20 2234 utcevergreen subscription evergreen event task logs https evergreen mongodb com task_log_raw wiredtiger_ubuntu1804_stress_tests_format_stress_sanitizer_test_eafea0553b62dead6c5f7338344e5ff1b1cea6a5_20_03_11_22_34_49 0typet;Build Failure;2020-03-13T00:39:51.000+0000;Closed;2020-05-06T07:06:16.000+0000;Major - P3;8.0;8;24;4;0;3;26;1;2;6
WT;WT-5784;fix rollback_fuzzer_clean_shutdown js errors log noformat js_testrollback_test a3bf 1583492591519 0 2020 03 06t110353 733+0000 rollbackfuzzer completed transaction cmd 137 lsid id uuid 60d02b9c c1d2 4b64 9d58 369d7601cf94 aborted due error js_testrollback_test a3bf 1583492591519 0 2020 03 06t110353 733+0000 n 0 js_testrollback_test a3bf 1583492591519 0 2020 03 06t110353 733+0000 writeerrors js_testrollback_test a3bf 1583492591519 0 2020 03 06t110353 733+0000 js_testrollback_test a3bf 1583492591519 0 2020 03 06t110353 733+0000 index 0 js_testrollback_test a3bf 1583492591519 0 2020 03 06t110353 733+0000 code 20 js_testrollback_test a3bf 1583492591519 0 2020 03 06t110353 733+0000 errmsg cannot remove capped collection js_testrollback_test a3bf 1583492591519 0 2020 03 06t110407 759+0000 rollbackfuzzer completed transaction cmd 163 lsid id uuid c5d812d9 c515 4b51 9e1d 28e269ed5d08 aborted due error js_testrollback_test a3bf 1583492591519 0 2020 03 06t110407 759+0000 n 0 js_testrollback_test a3bf 1583492591519 0 2020 03 06t110407 759+0000 nmodified 0 js_testrollback_test a3bf 1583492591519 0 2020 03 06t110407 759+0000 writeerrors js_testrollback_test a3bf 1583492591519 0 2020 03 06t110407 759+0000 js_testrollback_test a3bf 1583492591519 0 2020 03 06t110407 759+0000 index 0 js_testrollback_test a3bf 1583492591519 0 2020 03 06t110407 759+0000 code 263 js_testrollback_test a3bf 1583492591519 0 2020 03 06t110407 759+0000 errmsg collection db_1 two capped collection writes transactions allowed capped collections noformat link test failure https evergreen mongodb com task mongodb_mongo_v4 4_enterprise_rhel_62_64_bit_display_rollback_fuzzer_clean_shutdowns_patch_abd7daa5fce90afa115c808f1404a6854754d456_5e622694e3c33105e8944137_20_03_06_10_32_43;Bug;2020-03-08T23:00:49.000+0000;Closed;2020-03-09T00:19:32.000+0000;Major - P3;5.0;2;1;0;0;0;7;1;2;6
WT;WT-5763;review code handling non timestamp tombstones code reconciliation rec_upd_select handles tombstones timestamp transaction id https github com wiredtiger wiredtiger blame develop src reconcile rec_visibility c#l353 iterations possibly still isnt quite right review code least add big comment explaining code needs;Improvement;2020-03-05T09:58:12.000+0000;Open;2020-05-25T05:57:33.000+0000;Major - P3;5.0;4;7;0;0;1;28;1;2;6
WT;WT-5710;review wt_panic usage using wt_ret err_assert wt_panic insufficient panic system calling one wt_ret err_assert macros wt_panic error isnt sufficient need call underlying panic system routine wt_panic best fix might add wt_panic_assert macro review places set wt_panic cc luke pearson;Technical Debt;2020-02-28T21:04:59.000+0000;Closed;2020-05-06T07:06:11.000+0000;Major - P3;5.0;0;3;0;0;3;12;1;2;6
WT;WT-5677;prepare support durable history add test format stress tests make enhancements needed prepare support rollback_to_stable test format good stress tests may overlap testing using workgen clear need;Improvement;2020-02-25T21:02:45.000+0000;Closed;2020-05-06T07:06:09.000+0000;Major - P3;8.0;1;4;1;0;3;27;1;2;6
WT;WT-5673;prepare support durable history modify verify salvage needed review verify salvage code see changes need made prepare changes epic;Task;2020-02-25T20:49:23.000+0000;Closed;2020-05-06T07:06:07.000+0000;Major - P3;5.0;1;4;0;0;3;31;1;2;6
WT;WT-3726;add documentation specifying build pre requisites would helpful users documented dependencies building wiredtiger canonical way add install file root directory repository describe requirements wiredtiger core well parts package enabled disabled via configure options;Documentation;2017-11-07T00:05:10.000+0000;Closed;2020-04-21T13:20:23.000+0000;Major - P3;5.0;2;4;0;0;3;57;1;2;6
